Id	Sentence	Expert Judgement	Crowd Flower Judgements	Average	Dataset
1521	Second, problem of gas of cars will be reduced by people. a gas of cars are not remaining in the future forever.	0	[]	0.0	none
1522	A product needs to have advertisement so it gets to known around a place and it gets its population so everyone will like a piece of it.	2	[3, 1, 3, 2, 3]	2.3333333333333335	dev
1523	Most scientists say these bass play a much more significant role in the decrease of the menhaden population.	4	[3, 3, 4, 4, 4]	3.6666666666666665	dev
1524	The gas from cars will destroy the environment of the earth and it will heat earth up .	4	[4, 3, 3, 3, 3]	3.3333333333333335	test
1525	etc .	0	[]	0.0	none
1526	For example, disking also meets the same need.	4	[4, 4, 3, 3, 3]	3.5	train
1527	When someone have more than one academic subject it would be more amazing, interresting, positive, great, and helpfull.	3	[2, 1, 3, 3, 3]	2.5	dev
1528	One of the most offered service is the personal tour guide, that is usually hired by groups that arrive to places such a Cuzco or Cajamarca.	3	[3, 4, 4, 4, 3]	3.5	train
1529	Therfor, I think it will be more cars than today.	3	[3, 3, 3, 2, 3]	2.8333333333333335	dev
1530	because we are watching movie earn something.	1	[3, 2, 3, 3, 3]	2.5	dev
1531	in writting we are nearly unable to show the felings of people , but in the action on TV we can understand well than book.	3	[3, 2, 2, 3, 3]	2.6666666666666665	test
1532	One of the laws may to minimaze uses of cars.	3	[2, 1, 3, 3, 2]	2.3333333333333335	train
1533	Another one would guess there will be afew cars in future couse of the acts may take to prevent environmentel polution or to protect OZONE and stuff.	3	[3, 2, 2, 2, 4]	2.6666666666666665	train
1534	but now every thing is change, the life becom more dificullty .	3	[3, 3, 3, 3, 2]	2.8333333333333335	dev
1535	These kind of fish can't live so long in water that contain salt.	3	[3, 3, 4, 3, 4]	3.3333333333333335	test
1536	That is a totally lie.	3	[3, 3, 3, 3, 3]	3.0	train
1537	Every body no that the trueth today is a compitition maket in each and every field we are faceing compitition, for example if you are choosing you carree in software field than you have to master on that subject, than you can easily get a job.	2	[2, 3, 1, 3, 2]	2.1666666666666665	test
1538	The speed of car can't win the speed of a jet.	3	[3, 4, 2, 3, 4]	3.1666666666666665	train
1539	It was very big change in my life.	3	[3, 3, 3, 2, 4]	3.0	train
1540	Because you share only a single interest, thus making you a loner.	4	[3, 4, 3, 4, 3]	3.5	test
1541	Lots of people watch the advertisements in the house through TV or computer.	4	[3, 3, 2, 3, 3]	3.0	train
1542	Changed nature have dangerous possibility.	3	[1, 3, 3, 1, 3]	2.3333333333333335	train
1543	They should understand what the ideas and concepts they study mean in the practice, how they can be used and have already been used.	3	[3, 2, 4, 3, 4]	3.1666666666666665	dev
1544	I felt i can be more productive, more effecient, and will enjoy more life.	4	[3, 3, 3, 3, 3]	3.1666666666666665	train
1545	so many people face the lung cancer, etc.	3	[3, 2, 3, 3, 3]	2.8333333333333335	train
1546	In addition, students want to learn the language and they want to use it, so when they understand the concepts and the ideas it will help them to learn the language.	4	[3, 4, 4, 4, 4]	3.8333333333333335	test
1547	Therefore, understanding makes the amount of momerizing.	2	[3, 2, 1, 1, 3]	2.0	train
1548	In deed, they can be refuced.	3	[3, 3, 3, 3, 3]	3.0	test
1549	Since people will know what are being expected, a sense of trust and reliablity is formed.	3	[3, 4, 3, 4, 4]	3.5	train
1550	And after a period of time, has one specific to become the many academic subjects.	1	[1, 3, 3, 3, 2]	2.1666666666666665	train
1551	And no so many beauty clothes to weard.	0	[]	0.0	none
1552	Today is day to the change in my live.	2	[2, 1, 3, 3, 3]	2.3333333333333335	train
1553	Unfortunately we are individuals and living isolated on the society.	3	[4, 3, 4, 4, 3]	3.5	test
1554	I believe it depends on how fast science and engineering are improving.	4	[4, 3, 4, 4, 4]	3.8333333333333335	train
1555	I was quite lucky to chosen to be the leader of my class during junior high school.	3	[3, 2, 4, 3, 3]	3.0	train
1556	I think that they can be considered ART, only if they aren`t a negative thing for the wall on wich they are.	3	[3, 3, 3, 2, 3]	2.8333333333333335	train
1557	As taxes increase, people distort the market mechanism which determines price by real costs and buyers' free dicisions.	4	[3, 3, 3, 3, 2]	3.0	train
1558	Some products they sell it expensive because it was branded, some are cheaper because it was not branded product but if you'll see the quality, it's almost the same as the expensive one.	3	[3, 2, 4, 2, 3]	2.8333333333333335	dev
1559	It is therefore necessary to understand the idea behind it and come up with a well-organized concept.	4	[4, 4, 4, 4, 3]	3.8333333333333335	dev
1560	Many think that the treasure never existed.	4	[4, 3, 3, 3, 4]	3.5	train
1561	Due to that, i would state that the risk-taker will be more successfull.	4	[3, 4, 3, 4, 3]	3.5	train
1562	but if they needs money for these perpose they can do a extra hardwork.	3	[2, 2, 2, 2, 2]	2.1666666666666665	test
1563	Learn	4	[3, 4, 4, 3, 2]	3.3333333333333335	test
1564	However, after I learned all sides happening in a company such as marketing, accounting, leadership, financial accounting, and business communication etc..	4	[3, 3, 4, 2, 4]	3.3333333333333335	test
1565	It is not only that you are lucky enough to have a broader knowledge on things but for the fact that you were able to also help others as well.	3	[4, 3, 3, 3, 4]	3.3333333333333335	train
1566	What we need at present that goverments build more roads, streets and bridges to get ready to a near explusion of cars populations.	2	[3, 2, 3, 2, 3]	2.5	train
1567	I just enjoy what I get to do.	4	[4, 4, 4, 3, 3]	3.6666666666666665	train
1568	He knows how to draw a line of diffrence between gambling and taking risk.	3	[3, 3, 3, 4, 3]	3.1666666666666665	dev
1569	An example that confirms or supports my point is clear in the chinese cars.	4	[4, 3, 2, 3, 4]	3.3333333333333335	test
1570	Furthermore, it is way better to live on knowledge than on guess and common facts that anyone could learn through the medias.	3	[3, 3, 3, 4, 3]	3.1666666666666665	test
1571	It is the main resource for the cars to be working.	3	[4, 4, 4, 4, 4]	3.8333333333333335	test
1572	So, we must cooperate well with others, after we solve the today's problem.	3	[3, 3, 3, 3, 3]	3.0	dev
1573	From my personal experience, when I was very busy to find the information, the Internet very useful and fast tool.	2	[3, 4, 2, 2, 3]	2.6666666666666665	test
1574	"But then as it has been rightly said by someone ""We are the victims of our own greedy needs""."	4	[3, 3, 4, 3, 3]	3.3333333333333335	test
1575	I always appriciate my teachers because they makes me happy and they gave me an chance to study in United States.	3	[4, 3, 3, 3, 3]	3.1666666666666665	train
1576	The Bacteria is orginated on Mars and detected hydrogen frozeen.	2	[4, 3, 4, 3, 2]	3.0	train
1577	and they also can fly with keeping relation to Sun or stars.	2	[3, 2, 3, 3, 3]	2.6666666666666665	train
1578	We did not know what is the correct price and what shop is better.	4	[3, 3, 4, 3, 3]	3.3333333333333335	train
1579	This is very useful for them.	4	[4, 4, 4, 4, 4]	4.0	test
1580	It may tell us how large the world it is.	3	[4, 3, 3, 4, 4]	3.5	dev
1581	Apartments shows individual community verywell.	3	[3, 3, 3, 3, 3]	3.0	train
1582	So a prohibition wouldn't solve the real problem.	4	[4, 4, 4, 3, 4]	3.8333333333333335	dev
1583	though the preferrences might be different for a young person and for an older person to fully enjoy their life.	4	[4, 3, 3, 3, 3]	3.3333333333333335	dev
1584	Then , in the listening passage , professer said there is something found after 90 year, and no search before.	3	[3, 4, 2, 2, 3]	2.8333333333333335	train
1585	Post teenage, i.e college life, we may like to hang out with our friends for parties, movies, festivals etcetra.	3	[2, 4, 3, 3, 3]	3.0	train
1586	And they 'll explorer alot of saines like tha Tacnaloge right now	2	[2, 3, 2, 1, 2]	2.0	train
1587	But by then we have already bought the product and end up loosing the money .	3	[3, 4, 3, 2, 4]	3.1666666666666665	test
1588	In younger generation one can find more joy externally by chasing their dreams and in elderly people the it can be internal.	3	[1, 2, 3, 2, 1]	2.0	dev
1589	It has some problems that it can effect to humens.	2	[3, 2, 3, 2, 2]	2.3333333333333335	dev
1590	Sure, both arguments will probably decrease the number of cars, but the strongest argument speaks for itself: China.	4	[3, 4, 4, 4, 4]	3.8333333333333335	dev
1591	In fact, I am not an expert in the subject, but I would say I disagree with the statement listed and predict an increase of cars in the following twenty years.	4	[3, 4, 3, 3, 4]	3.5	train
1592	It mentions that now, it has reached to some oarts of North America.	4	[3, 3, 3, 2, 3]	3.0	dev
1593	and we says that these countries gonna be the next developed countries.	3	[3, 3, 3, 2, 3]	2.8333333333333335	test
1594	My 10th exam and 12th exam is very good.	3	[4, 3, 3, 3, 3]	3.1666666666666665	test
1595	And I expect, if we lose quanlities of cars , we will protect our life, our environment, and we will not depend on resourse gas,	3	[2, 4, 2, 3, 3]	2.8333333333333335	dev
1596	That is quite incredible, not to mention the fact that it might have been carved around 4,500 years ago.	4	[3, 4, 4, 4, 4]	3.8333333333333335	train
1597	So I consider that Governments should spend more money in support of athletics as state-sponsored Olympic teams.	3	[3, 3, 3, 3, 4]	3.1666666666666665	train
1598	The first theory why the Anasazi vanished suddenly is global warming.	3	[3, 4, 4, 3, 3]	3.3333333333333335	train
1599	I think it is a good way to teach youth empathy and encourage them to spend their time on something beneficial for their community.	4	[3, 3, 4, 3, 4]	3.5	train
1600	Also smart car of TOYOTA enable us to find road and to utilize various functions.	3	[3, 3, 3, 3, 3]	3.0	train
1601	However, the lecturer have a oppsite opinion about this.	3	[3, 4, 4, 3, 3]	3.3333333333333335	train
1602	I claim that they are not yet able to feel the same feeling of satisfaction that an old man, seing his grandchilds playing, does have.	3	[3, 3, 3, 2, 3]	2.8333333333333335	dev
1603	But in my opinion the high school there are free for all people.	3	[2, 3, 3, 2, 3]	2.6666666666666665	train
1604	In my point of view ; the cars amount will increase the double in twenty years , becuase people will increase and they need cars for they everyday jobs.	3	[3, 4, 3, 3, 2]	3.0	train
1605	Hence, I did not have to wake up too early this morning, I took the underground, and the train, then the underground in Rome.	3	[3, 3, 4, 3, 4]	3.3333333333333335	dev
1606	if they do thing they go for another untill they know how it woek and what is useful think of it .	1	[2, 3, 2, 1, 1]	1.6666666666666667	test
1607	I am sure that most of the kid knew that this was not the way their parents teached them, because they do not know why was it wrong or why should they do the ways their parents told.	2	[3, 3, 2, 2, 3]	2.5	test
1608	On the other hand, I know that the base of the communication is that you speak the same language.	4	[3, 4, 4, 3, 4]	3.6666666666666665	train
1609	we can see young people working over countries or working for others with tools like telephones or internet even if they look they spend their time just for themselves by being whole day in their room.	2	[4, 1, 2, 3, 3]	2.5	test
1610	I could become friends with many foreign people.	4	[3, 3, 4, 4, 3]	3.5	train
1611	It can't be considered as a major full time job.	4	[3, 4, 3, 4, 4]	3.6666666666666665	train
1612	Even though there could be agruments that there will be more cars, I think the gas and pollution problem is a fact we are already noticing.	4	[3, 3, 2, 4, 4]	3.3333333333333335	train
1613	so not in twenty years don't think so .	2	[3, 3, 3, 3, 3]	2.8333333333333335	train
1614	Also, most of people prefer to entertain athletics rather than other arts.	3	[4, 3, 4, 3, 3]	3.3333333333333335	test
1615	There fore , he likes to do arisky and strainge things and he enjoy it.	3	[3, 4, 3, 2, 2]	2.8333333333333335	test
1616	So what if we occassionaly fall for a good comercial.	4	[2, 3, 3, 3, 3]	3.0	train
1617	But after a few days, I found myself enjoying in it.	3	[4, 4, 3, 4, 4]	3.6666666666666665	test
1618	However, what if they just work for the field which they already know how to do well, they might feel sad and tired.	3	[3, 3, 4, 2, 3]	3.0	test
1619	I think it does not mean that way.	4	[4, 4, 2, 4, 3]	3.5	train
1620	Edison, who invented a bulb, is obvious example.	3	[3, 4, 4, 4, 3]	3.5	dev
1621	other thing is.	0	[]	0.0	none
1622	In such situations, the general doctor may refer the patient suffering from these disease to an expert.	3	[3, 3, 3, 4, 3]	3.1666666666666665	train
1623	For instance, if a student gets wrong on the test.	3	[3, 3, 3, 1, 2]	2.5	train
1624	Many people think that treasure never existed, but in reality it exits.	3	[3, 4, 2, 3, 4]	3.1666666666666665	dev
1625	To begin with, the young people who hope that they sucide are incleasing.	2	[2, 3, 2, 3, 2]	2.3333333333333335	train
1626	Maybe I can not enjoy in real meaning and I am tired.	2	[2, 2, 3, 4, 3]	2.6666666666666665	dev
1627	Sometimes the students learn form class, but they have find the other ideas from outside the class.	3	[3, 2, 2, 3, 3]	2.6666666666666665	train
1628	I belive to have broad knowledge to specialize in one specific subject have outweigh than to have broad knowledge of many academic subjects.	2	[3, 3, 2, 3, 2]	2.5	test
1629	In my opinion if someone thinks one is more important than other why not to focuse on one?	3	[3, 3, 2, 4, 3]	3.0	test
1630	This does not imply that either person is not enjoying life, or enjoying it to a different degree.	4	[4, 4, 4, 3, 4]	3.8333333333333335	dev
1631	How could a scientist start unravelling a new world and at the same time be expert in another field?	4	[3, 3, 3, 3, 3]	3.1666666666666665	train
1632	And people feel more arkward when it comes to their ears that this is something going on as a current event.	4	[2, 3, 2, 3, 4]	3.0	test
1633	He would never want his business or company to be stagnant.	4	[4, 3, 4, 4, 4]	3.8333333333333335	test
1634	However, I woud prefer traveling by myself with the good prepation filled with joy.	3	[3, 2, 4, 3, 3]	3.0	test
1635	the carebendiocside is very harm full for the people.	3	[3, 3, 3, 2, 3]	2.8333333333333335	test
1636	Even if they use buses, whtch are big cars, the fact pepole taking bus still reduce the number of the car.	3	[3, 2, 4, 3, 2]	2.8333333333333335	dev
1637	Our group decided to open Waseda Cafe.	4	[4, 4, 4, 4, 3]	3.8333333333333335	dev
1638	First, the characteristic of Old Kingdom depictions of kings is possessed at the head of the Sphinx.	3	[2, 3, 1, 3, 3]	2.5	train
1639	"and i had listen ""success attract success and money attract money"""	3	[3, 3, 2, 3, 3]	2.8333333333333335	test
1640	I agree that the use of cars is increased today.	4	[3, 4, 4, 3, 4]	3.6666666666666665	train
1641	Because it is more convinient to move by the airplane and car.	3	[3, 3, 3, 3, 2]	2.8333333333333335	train
1642	Nowadays so many people study the way that makes advertisemets increase the sells, that is why our behaviour is influenced by what we listen or what we see on the television.	3	[2, 1, 3, 3, 3]	2.5	dev
1643	Also they can go for shopping and buying a new fashionable clothes .	3	[3, 3, 4, 2, 3]	3.0	test
1644	It's really a good film.	4	[4, 4, 4, 4, 4]	4.0	test
1645	Finally, they don't like to stay doind the easy things.	4	[2, 3, 3, 3, 3]	3.0	train
1646	still exist.	0	[]	0.0	none
1647	For instance, Leonardo Davinchi had inspected many creative inventions.	4	[3, 3, 3, 3, 3]	3.1666666666666665	train
1648	After that i studied in more depth to the topics and understood the ideas and concept of the topic.	3	[2, 2, 4, 4, 3]	3.0	test
1649	Each failure can teach a new way to his/her to how resolve the main problem.	3	[3, 4, 2, 4, 2]	3.0	train
1650	Those ads that we found in our favorite TV show, on the traffic sides, when we read the newspaper, when we travel outside the country, when we go online, when we go to a public restroom, when...	3	[3, 4, 3, 3, 2]	3.0	train
1651	But with a car you can make a trip wherever you want to.	4	[2, 4, 3, 4, 3]	3.3333333333333335	train
1652	No free time make not good future.	3	[3, 3, 3, 3, 2]	2.8333333333333335	train
1653	When the forest is caught on fire the wood turns into ashes which is pottesium.	3	[3, 3, 2, 4, 3]	3.0	test
1654	In my opinion , cars will be took full use of in the twenty years.	2	[3, 2, 4, 2, 2]	2.5	test
1655	which was i wanted to take experience on it since I was at middle school.	2	[2, 1, 1, 1, 1]	1.3333333333333333	train
1656	in the fact the matter that alot of acadmic subject can not be used seperatley.	1	[3, 3, 3, 3, 3]	2.6666666666666665	test
1657	It is attributed to the fact that being in some places that can be dangerous situation, such as a owner of venture marketing includes advantages and disadvantages.	2	[2, 3, 4, 3, 3]	2.8333333333333335	train
1658	Mankind could make it to the moon only because one individual, of the name Neil Armstrong was ready to try out something that was never tried out before, even if it meant risking his life in the process.	4	[4, 3, 3, 3, 4]	3.5	train
1659	However, I also feel good about this because this shows the huge leap we could make in twenty years, not just small steps.	4	[4, 4, 3, 3, 4]	3.6666666666666665	dev
1660	According to the lecture, management should plan carefully when hire well-trained people or teach them how to manage the fire in a better way before fire.	3	[3, 2, 3, 3, 3]	2.8333333333333335	test
1661	And it is important to have emotions in classes like history or social studies.	4	[4, 3, 3, 3, 4]	3.5	test
1662	The young people were influnced by the interaction of the behavior of their friends.	4	[3, 3, 4, 3, 4]	3.5	train
1663	She also use this to challenge the reading passage.	3	[3, 4, 3, 3, 4]	3.3333333333333335	dev
1664	"In this way a person always feels to be original and ""modern"", not ""ancient"" like people that surroand him or her."	2	[3, 3, 3, 3, 3]	2.8333333333333335	dev
1665	I am so happy that I was trying to learn art and found real my talent.	3	[4, 3, 4, 3, 4]	3.5	train
1666	I need to understand what are carbohydrates, proteins, vitamins and minerals and how they are unfolded in our body to produce ATP.	3	[3, 4, 3, 3, 3]	3.1666666666666665	dev
1667	Because today most people have choisen ivendualty.	2	[3, 3, 3, 3, 3]	2.8333333333333335	train
1668	and none of tourist will come and yellowstone will not be popular and of course , local businesses that depended on park visitors suffered as a result.	2	[2, 1, 3, 2, 2]	2.0	dev
1669	Becaused we are get more comfitible.	3	[3, 3, 3, 2, 3]	2.8333333333333335	train
1670	In the oldage the people have leave all the burdens and they are spending their own interested work.	2	[3, 2, 3, 2, 2]	2.3333333333333335	test
1671	This will surely lead to a decrement in the number of cars as people would prefer buying a buss pass which would prove to be lighter on their pockets as compared to purchasing fuel for their cars.	4	[3, 3, 2, 3, 3]	3.0	train
1672	Every time when we meet, I will look forward to the new things.	3	[4, 3, 3, 2, 4]	3.1666666666666665	test
1673	When we go to their home, they look like to be hapiness.	2	[2, 2, 3, 3, 2]	2.3333333333333335	dev
1674	By encouriging the students in the schools and the universities to valenter to help the communitie, by visiting the hospitals, the houses for the old people and every way where can they help.	0	[]	0.0	none
1675	One more reason that may be less popluar is the fact that people are always in a rush and would not have time to walk, cycle or take a bus to their specific place of destination.	4	[3, 4, 3, 3, 4]	3.5	train
1676	But if all you want is stay at home and live on your own, perhaps it is not that important for you.	3	[4, 3, 4, 4, 3]	3.5	dev
1677	Our country have been criticizing on the one way teaching.	2	[4, 4, 4, 3, 2]	3.1666666666666665	dev
1678	If you see some flying cars on the air a feew years ago, do not be afraid.	3	[2, 3, 3, 3, 2]	2.6666666666666665	train
1679	For that reason, I started to believe that young people can enjoy their life more than older people do.	4	[3, 3, 4, 3, 4]	3.5	train
1680	it is useless for a student to learn somthing without khnowing her origin.	4	[3, 3, 3, 3, 3]	3.1666666666666665	train
1681	Another reasons the speaker said is the possibilty on the fact that Polo was unexperienced the tea culture.	2	[2, 2, 1, 2, 2]	1.8333333333333333	train
1682	Althogh some people say that the treasures are already found.	4	[3, 4, 3, 3, 3]	3.3333333333333335	test
1683	S/he might know the properties of a dictorial state.	4	[3, 3, 3, 4, 3]	3.3333333333333335	train
1684	Probable owner would know where he hide his tresure.	3	[3, 3, 3, 3, 3]	3.0	train
1685	As far as I am concerned I agree with this statement, however some people are not agree with my opinion.	3	[4, 3, 3, 3, 3]	3.1666666666666665	test
1686	For example , ideas some phisician in treatment the same disease different .	1	[3, 3, 3, 2, 1]	2.1666666666666665	train
1687	In short, what is it that leads us to the fact is important.	3	[3, 3, 3, 3, 3]	3.0	train
1688	Eventually.	0	[]	0.0	none
1689	"Becase while the goverment raise the gas tax , on the other hand , they may decrease the income tax for the low incoming families to make sure that they won""t suffer a lot ."	3	[2, 2, 2, 2, 2]	2.1666666666666665	train
1690	However, in the lecture, the professor says the spopt specificaly- the tressure is in Esypt.	4	[3, 2, 2, 3, 3]	2.8333333333333335	train
1691	It is also possible that travelers could be re-schedule the plan and the destinations.	3	[4, 3, 3, 3, 4]	3.3333333333333335	dev
1692	If they do not used the car they will be later for working.	3	[1, 3, 2, 3, 2]	2.3333333333333335	train
1693	It is not much less frequent, though, and it still fulfills the needs that we have for it today.	4	[4, 3, 4, 4, 2]	3.5	dev
1694	our society is in a constant evolution we can not say we do not con\sider.	2	[2, 2, 3, 3, 3]	2.5	train
1695	Carusage in the United States is very important in every day life, aswell as in many latinamerican countries, and thirdworld countries.	3	[3, 3, 3, 3, 2]	2.8333333333333335	test
1696	We also know who killed him because the man was caught.	4	[3, 4, 4, 4, 3]	3.6666666666666665	train
1697	However this costs are much more expenxive than where producing in factories.	3	[3, 3, 2, 3, 3]	2.8333333333333335	train
1698	as a conclution you are not atracted totaly by the product but, by the lifestile that this product will give to you.	3	[4, 3, 2, 3, 2]	2.8333333333333335	dev
1699	Having broad knowledge would allow us to be on a good social standard.	3	[3, 3, 4, 4, 4]	3.5	train
1700	However, companies tend to cut thier profits for workers.	3	[4, 4, 3, 3, 3]	3.3333333333333335	test
1701	Since for my father, his life goal as to get the job that he wants and have family is already achieved, he has no concern about his future.	2	[3, 3, 3, 3, 1]	2.5	train
1702	I am a graduate of Physical Therapy and will now pursue a career in this field.	4	[3, 3, 4, 4, 4]	3.6666666666666665	train
1703	Many people are willing to buy these cars.	4	[4, 3, 4, 4, 4]	3.8333333333333335	test
1704	The one is the Copper Scroll.	4	[3, 1, 1, 3, 4]	2.6666666666666665	test
1705	America wich is the freedom country.	0	[]	0.0	none
1706	Many countries occor problems of the scanty of fluent, much increse of consumation finance in one's family and the lack of paths for driving a car.	1	[3, 1, 3, 1, 2]	1.8333333333333333	train
1707	Finally, the govermen5t sould raising the tax just for the gasoline not for the other stuff.	3	[3, 3, 2, 4, 3]	3.0	train
1708	Therefore saler have to increase their sale amounts .	3	[3, 3, 2, 3, 3]	2.8333333333333335	train
1709	I remeber the story, when a person was in a difficult circumstances and he really needed the help of his friend.	3	[3, 3, 3, 3, 3]	3.0	train
1710	our successful life ..	0	[]	0.0	none
1711	Though I am from Fukuoka, now I live in Yokohama in order to go to Yokohama City University.	4	[4, 4, 4, 3, 3]	3.6666666666666665	dev
1712	magnetite crystals serve birds as an internal compass.	4	[3, 3, 4, 3, 3]	3.3333333333333335	train
1713	Another sollution could be the developing of more fuel efficient cars, wich could also be good for America's car manifacturers who will produce more attractive cars to sell to other countries.	3	[4, 4, 3, 3, 4]	3.5	test
1714	What is hard is to sprate the news from rummers.	3	[3, 3, 2, 2, 3]	2.6666666666666665	train
1715	In the twenty years, they also can give us the better cars to use less resources-consumed transportation tools and give us the much more convenience tools for our travelling.	2	[4, 3, 4, 2, 3]	3.0	dev
1716	Instead, indivuality is seen as the crucial part of the society.	4	[2, 3, 3, 3, 4]	3.1666666666666665	train
1717	It is necessary a breakthrough event or product to succeed.	3	[3, 3, 4, 3, 3]	3.1666666666666665	dev
1718	I am yet to hear in an advertisement of a former 500-pound person losing 360 pounds to become a fitness instructor who is either treading on a treadmill or working his, or her, abdominal muscles throughout an advertisement.	3	[3, 2, 4, 4, 2]	3.0	train
1719	Consequently, I agree the statement with regard to three reasons: effecting of view , face to face with people and the first time.	2	[3, 4, 3, 4, 2]	3.0	test
