Id	Sentence	Expert Judgement	Crowd Flower Judgements	Average	Dataset
1	If the teacher once entered in to the class she should be well preaperd of what she is going to explain.	3	[3, 3, 3, 4, 2]	3.0	train
2	So I think we can not live if old people could not find siences and tecnologies and they did not developped.	2	[2, 2, 1, 2, 3]	2.0	test
3	New and new technology has been introduced to the society.	3	[3, 4, 3, 3, 2]	3.0	dev
4	For not use car.	1	[3, 4, 3, 4, 3]	3.0	test
5	Here was no promise of morning except that we looked up through the trees we saw how low the forest had swung.	3	[2, 4, 3, 2, 3]	2.8333333333333335	test
6	Students can improve themselves by thinking on a subject that they learn the major ideas, they will become more creative and more observer and that characteristics obviosly help them during their life time.	3	[3, 3, 3, 3, 2]	2.8333333333333335	train
7	then, it gets spread area.	2	[3, 1, 2, 3, 3]	2.3333333333333335	train
8	One possible outcome is that an environmentally-induced reduction in motorization levels in the richer countries will outweigh any rise in motorization levels in the poorer countries.	4	[3, 4, 3, 4, 3]	3.5	dev
9	Goverment should check of the information that advertisment give to people.	3	[3, 3, 3, 2, 3]	2.8333333333333335	train
10	Thus even today sex is considered as the least important topic in many parts of India.	4	[4, 3, 4, 3, 3]	3.5	test
11	i was offered a variety af subjects.	4	[3, 4, 4, 3, 3]	3.5	train
12	Every person needs to know a bit about math, sciences, arts, literature and history in order to stand out in society.	4	[4, 4, 4, 3, 4]	3.8333333333333335	dev
13	If they change them, the story will collape and be incorrect information.	3	[3, 3, 4, 4, 3]	3.3333333333333335	train
14	However, now many car companies struggle to develop an eco-car, such as Prius of Toyota.	4	[3, 3, 4, 4, 3]	3.5	train
15	However, I do not agree with the statement by the following reasons.	3	[3, 3, 3, 3, 3]	3.0	train
16	image you salf you are wark in factory just to do one thing like pot taire on car if they fire you you will destroy , becouse u dont know more than pot taire in car .	2	[3, 1, 1, 2, 1]	1.6666666666666667	test
17	One example can be given from the Computer Sciences where a lot of conceptual understanding is required rather than just learning the facts of how to code a software program such as learning the semantical fundementals of a programming language.	4	[3, 3, 4, 4, 4]	3.6666666666666665	train
18	While the travel company will most likely show them some interesting sites in order for their customers to advertise for their company to their family and friends, it is highly unlikely, that the company will tell about the sites that were not included in the tour -- for example due to entrance fees that would make the total package price overly expensive.	3	[4, 4, 2, 3, 3]	3.1666666666666665	dev
19	Disadvantage is parking their car is very difficult.	3	[3, 2, 3, 1, 3]	2.5	dev
20	They draw the consumers, like me, to purchase this great product with all these amazing ingredients and all that but actually they just sometimes make something up just to increase their sales.	4	[3, 3, 4, 3, 2]	3.1666666666666665	test
21	"This is an easy way of life, because they make only the ""secure"" things."	4	[3, 3, 4, 4, 4]	3.6666666666666665	train
22	I want to talk about nocive or bad products like alcohol, hair spray and cigarrets.	2	[3, 3, 2, 3, 3]	2.6666666666666665	test
23	For example they can play football whenever they want but the olders can not.	3	[3, 3, 4, 3, 3]	3.1666666666666665	test
24	if the quality of the product is good and it is worth using customer will definetly buy it.	3	[3, 3, 3, 3, 3]	3.0	train
25	This isnt very helpfull cause the owner needs to spend more money on transport and goods for the workers.	4	[3, 3, 2, 3, 3]	3.0	train
26	Bigger farming are use more chemical product and substance to feed fish .	3	[3, 4, 2, 3, 3]	3.0	dev
27	Whereas, a community for the old and underprivleged would want help, aid and assistence from the youth.	3	[3, 3, 3, 3, 4]	3.1666666666666665	train
28	If our scintist may not take the risk then how we can develope the new things and how we can make our life very comfartable and enjoyful.	3	[2, 3, 3, 2, 2]	2.5	train
29	For example, if people wants to go traveling by plane, which will be definitely a popular transportation in the future, they have to drive a car or take a taxi or a bus to the airport.	3	[3, 3, 4, 4, 3]	3.3333333333333335	train
30	Forexample, My cousin is 12years old.	4	[3, 3, 3, 3, 3]	3.1666666666666665	dev
31	Finally student become more knowladgable and confident about knowladge.	3	[3, 3, 3, 2, 2]	2.6666666666666665	train
32	It figures Diana Krall wearing a Rolex watch and has a text that suggests that if the reader wants to belong to the restricted club, not necessarily of Rolex watch wearers, but of highly talented, sophisticated and competent artists, he or she should also have a Rolex.	4	[3, 3, 3, 3, 3]	3.1666666666666665	test
33	When we started evaluating on those to drop and those not to, I had dropped about a lot and now I can concetrate much better with the little I offer.	3	[3, 3, 4, 2, 2]	2.8333333333333335	train
34	if it does, you will only get some misundrestood idea about that acticle but not the original one.	3	[3, 3, 4, 3, 3]	3.1666666666666665	dev
35	Secondly, chimp can also present the capability for grammer which means it can demonstrate the ability to combine words and be able to use grammatical constructions.	3	[3, 3, 4, 3, 3]	3.1666666666666665	dev
36	Nevertheless, this city is having a big change.	4	[3, 4, 3, 4, 4]	3.6666666666666665	dev
37	I think to learn facts is only an evidence if the students can work hard and if they are able to keep every detailled information as tought, but it's definitly not an evidence for their intelligence.	3	[3, 4, 3, 2, 2]	2.8333333333333335	dev
38	Unforturntly, almost older people can not use internet, in spite of benefit of internet.	3	[3, 2, 3, 3, 3]	2.8333333333333335	dev
39	Facts can learn through many books.	3	[3, 3, 2, 3, 2]	2.6666666666666665	train
40	So, if i have alot of information about this subject , i will taulk too much with knowledge but if i have general information for this subject , i will talk about this subjec with my limited knowlege and this case may be make me shame like when my brother asked me about some thing but i have not alot of information about this thing.	3	[1, 3, 3, 3, 3]	2.6666666666666665	dev
41	becuse if i see some one did somthing to may safe me time and engy and it wok's i will do it .	2	[2, 2, 3, 2, 3]	2.3333333333333335	dev
42	But when i finished medical school i was only able to specialize in one field because you can never master all what you have studied in medical school, which makes sense in a way or else there would be no specialities in medicine.	3	[3, 3, 3, 3, 2]	2.8333333333333335	train
43	Maybe some of them just couldnt graduate from a single academic course but this is because he is not that type of human.	3	[3, 3, 3, 3, 1]	2.6666666666666665	train
44	He/she is simply left with no time to cope with mundane things, leave alone the community he/she lives in!	3	[4, 3, 4, 4, 3]	3.5	train
45	There are several reason.	3	[4, 3, 3, 3, 4]	3.3333333333333335	test
46	According to the reading the dinosaur is not an endotherm.	4	[3, 3, 3, 4, 1]	3.0	train
47	The government should think about the whole nature.	3	[2, 4, 4, 3, 4]	3.3333333333333335	dev
48	However instead of going for the class and having a good idea of what psycology is and some theories explaied concepts of it I rather memorized all of them.	2	[3, 3, 3, 3, 2]	2.6666666666666665	train
49	This will give him the oportunity to find a good job related to his familiar abilities.	4	[4, 4, 3, 4, 3]	3.6666666666666665	train
50	They will not be able to compete with other similar brands and the product will fizzle out or die.	4	[4, 4, 4, 4, 4]	4.0	dev
51	People are now opening their eyes to the scenario when we would run out of fuel.	4	[4, 4, 4, 3, 3]	3.6666666666666665	dev
52	Also the work of the media, television, magazines, and every stuff made for publicity affects the emotions of many people around the world, encouraging them to buy and buy anything they can.	3	[3, 2, 4, 3, 4]	3.1666666666666665	test
53	but through high fuel efficieny point lecture cast doubt on the reading passage.	3	[1, 3, 1, 2, 2]	2.0	train
54	For me it was great because I need to talk on the phone locally and nationally for long periods of time.	4	[4, 4, 4, 4, 4]	4.0	dev
55	Since most urban areas are occupied with cars, they are all facing up with an irresistible problem of air and noise pollution.	3	[3, 3, 4, 3, 3]	3.1666666666666665	test
56	But experts believe that it was a result of erosion that happened when Egypt's weather condition was	0	[]	0.0	none
57	It is true that consumers preffer to buy a product that has a lower price, but when international companies that has already the certification begins to send its market , people will preffer to consume theirs because the difference between prices is probbably not going to affect them to much.	3	[3, 3, 2, 3, 1]	2.5	test
58	4:they have a big chance to prepare for their future life	4	[3, 3, 2, 3, 2]	2.8333333333333335	test
59	As the human settements increase and agriculture also increases and also the use of chemical pesticides.	3	[1, 2, 2, 2, 3]	2.1666666666666665	train
60	One person if don't have good health that means so many things they could lost.	3	[3, 2, 2, 1, 3]	2.3333333333333335	test
61	Many studies over the last 50 years have shown that people who have fluoride in their drinking water are considerably have less cavities than people who have not drinking nonfluoridated water.	3	[3, 3, 3, 3, 2]	2.8333333333333335	test
62	They only care if the effects are good and popular among the crowds.	3	[4, 4, 4, 3, 2]	3.3333333333333335	dev
63	That is why calculated risks, as one could call them, are the predecessors of big success, because they get people's attention by giving people new options.	4	[4, 4, 4, 4, 4]	4.0	dev
64	It was more fun to explore somewhere new outside the places we knew well.	4	[3, 3, 3, 3, 3]	3.1666666666666665	train
65	maybe not giving the exsact same response (because every thing in nature changes) but some thing prox.	0	[]	0.0	none
66	I strongly desagree with the statement proposed and defenitely don`t want to believe that young people don`t spend time helping the community they live in.	4	[3, 3, 4, 2, 3]	3.1666666666666665	train
67	Likewise, The theory generating from the concept of memory is also not the appropriate way due to limited memory.	3	[3, 3, 3, 4, 4]	3.3333333333333335	test
68	in organisations when the CEO or the MD makes a decision about the persons that can be mentored to take up the leadership position in the comming time after the current leadership devolves power the are given experience in all the departments of the company .a person may be a engineer by qualification but when being developed to take up the top job he is made to go through posting in all the departments so that he can have proper knowledge of the workings of all he departments .	0	[]	0.0	none
69	because they spent time unmeaningful subjects.	2	[3, 3, 3, 3, 3]	2.8333333333333335	test
70	I was very fast, my best time was 55 seconds in 400 hundred meters is a good time in or country.	2	[2, 2, 3, 2, 2]	2.1666666666666665	test
71	And young people spend time more ther lifestile.	2	[4, 3, 2, 3, 3]	2.8333333333333335	test
72	Conclusively, I think other transportations are more convenient than cars and there should be fewer cars and the streets will be no traffic jam and less air pollution, it's my opinion.	3	[2, 3, 2, 1, 2]	2.1666666666666665	train
73	But I want to be selfish when I travel.	4	[3, 3, 4, 4, 4]	3.6666666666666665	train
74	He said in other words that the more flouride may create damage in human body, specifically the bone.	3	[3, 3, 4, 3, 3]	3.1666666666666665	dev
75	When these people create their new ideas others often look very strange on them.	3	[4, 4, 3, 4, 2]	3.3333333333333335	dev
76	If in this society who will not to do study they never concept there opportunity or can't understand any ideas so most of the important that in this situation and I also very interestion and also prefer that for the study material.	1	[1, 2, 3, 1, 3]	1.8333333333333333	test
77	This is a universal truth.	4	[3, 4, 4, 3, 3]	3.5	train
78	You will learn to socialize with people.	4	[4, 4, 4, 4, 4]	4.0	dev
79	We have to know this problem it's serious but almost people doens't know about this.	3	[4, 3, 4, 1, 2]	2.8333333333333335	test
80	And the evidence of it is the complicate water-control system.	3	[3, 3, 3, 3, 4]	3.1666666666666665	train
81	No ohter transportation concept has been as successful as the car, not only because the goog street and highway system throughout the United States and Europe, but only because off the fact, that people love their cars.	2	[2, 2, 2, 3, 3]	2.3333333333333335	dev
82	It seems really good apatize.	2	[1, 2, 1, 2, 2]	1.6666666666666667	train
83	This is most clearly shown in the field of economics.	4	[4, 4, 3, 4, 4]	3.8333333333333335	train
84	If they prefer to choose cars than motor bike, that means there will be many cars.	3	[2, 3, 3, 2, 3]	2.6666666666666665	dev
85	They don't have a big meat like on TV.	3	[3, 3, 3, 3, 3]	3.0	train
86	And it may increase more speeders.	3	[3, 3, 4, 4, 4]	3.5	train
87	Obviously the doctor participate in the trial of these medications and they work for months and years to standarize the dose, the effects on the ailment , its side effects, physical and psychological dependance, and more over its toxic effects on the living being.	3	[3, 2, 3, 3, 2]	2.6666666666666665	train
88	Students can focus on only a few subjects they are intwerested in and they will become an experts in those areas.	4	[3, 3, 2, 3, 3]	3.0	test
89	That's why he is a legend in these days and people repect him.	3	[3, 3, 3, 3, 4]	3.1666666666666665	dev
90	Suth as, culers and people	0	[]	0.0	none
91	But in other waythismakes other way country need to pay extra money to make, repair the roads What they did is reduce the amount of gas consumers, high the gas tax, and low the income tax because they thought, only rise the gas tax is unfair.	2	[4, 2, 1, 3, 3]	2.5	test
92	Second, it is truffce that	0	[]	0.0	none
93	Today, MBA students with a background in engineering are in high demand.	4	[3, 3, 3, 4, 4]	3.5	test
94	For example, video materials will help instructing to students.	3	[3, 3, 2, 3, 3]	2.8333333333333335	train
95	In the case of young people the best way is studying as hard as possible to get better grades so in the future they will have better chance to find better jobs.	4	[3, 4, 3, 4, 3]	3.5	test
96	I think these researches are very noble and hopefully they will provide a better energy source.	3	[3, 3, 3, 4, 3]	3.1666666666666665	train
97	So the school try learning the students a bit in every science exist.	2	[3, 2, 1, 2, 1]	1.8333333333333333	test
98	for example, in math club, teachers usually teach us how to solve a math problem using vary ways.	3	[2, 3, 3, 2, 3]	2.6666666666666665	dev
99	I think they have to get skill on it.	3	[3, 4, 3, 4, 3]	3.3333333333333335	test
100	Specializing in one particular subject does not suit our life in this era which is characterized by diversity and innovation	4	[3, 3, 3, 4, 3]	3.3333333333333335	test
101	Therefore, The car in use will be increaced in next twenty years or in the future.	3	[3, 3, 3, 2, 3]	2.8333333333333335	train
102	Is important also have parent`s and friend`s advices for help us do the best thing.	2	[3, 3, 3, 3, 2]	2.6666666666666665	train
103	These things are what I can not learn from the textbooks.	4	[3, 3, 4, 3, 4]	3.5	train
104	I will explain my points of views in the following paragraphs.	3	[4, 3, 4, 3, 3]	3.3333333333333335	test
105	we need teacher or book.	3	[3, 3, 2, 3, 3]	2.8333333333333335	train
106	Personally, I do not like to travel in a group led by a tour guide.	4	[3, 4, 4, 4, 4]	3.8333333333333335	train
107	In order hand, when I was a fresh man in my college, I could concentrate on my favorit subjects.	3	[2, 3, 3, 3, 3]	2.8333333333333335	dev
108	He thinks differently from other people and he succeded.	3	[3, 3, 4, 4, 3]	3.3333333333333335	test
109	These activities make the community a better place to live in and inculcate these values in all the members.	3	[3, 3, 3, 4, 4]	3.3333333333333335	test
110	I have an IBM computer and my laptop is DELL.	4	[4, 3, 4, 4, 4]	3.8333333333333335	dev
111	By the way, glutten is highly correlated with autism, a form of psychosocial disorder among childrens.	4	[3, 3, 3, 4, 3]	3.3333333333333335	train
112	not only, i prefer to make decision for myself, but also i think that others also want to have the oppotunity of decision- making.	3	[3, 3, 3, 2, 3]	2.8333333333333335	train
113	So if the company buys eco-certified wood it will be expensive.	4	[2, 4, 4, 3, 3]	3.3333333333333335	train
114	Fuel is getting depleted and thus the governments are made to pay a lot to import fuel and thus leading to hike in fuel prices and making the layman think about the utilization of cars which are costing him a lot.	3	[2, 4, 3, 2, 2]	2.6666666666666665	train
115	read book as when i speaking help me. example good speak is good book ..	1	[2, 3, 3, 1, 1]	1.8333333333333333	train
116	All the resources and mateials are open to everyone, that includes both the yong and the old.	4	[3, 3, 3, 3, 3]	3.1666666666666665	train
117	Beacuse all those broad knowledge help they to understand their major in university as well as help they to make a correct choice in specializing study.	3	[2, 1, 1, 1, 1]	1.5	test
118	And it was very easy to me to understand why he always brang bad marks at home.	2	[3, 3, 3, 3, 3]	2.8333333333333335	test
119	You are not motivated to read or do research to know about the place you are going to visit prior to your trip.	4	[3, 4, 3, 3, 4]	3.5	train
120	well, he or she do not learn anything.	3	[2, 3, 2, 3, 3]	2.6666666666666665	train
121	Besides, many private institute to learn creat in our society.	2	[3, 3, 3, 3, 3]	2.8333333333333335	train
122	For example TOEFL test makes grades.	3	[3, 3, 4, 2, 3]	3.0	train
123	An individual had to practise and understand ideas and concepts before they work.	2	[4, 3, 3, 4, 3]	3.1666666666666665	train
124	Then when we went to the Science Olympiad, she could have diverse knowledges about the subects and it was not new for her to think about new things.	3	[3, 3, 2, 1, 3]	2.5	test
125	With people becoming aware of it day by day there is a feelong amongst them to make use of cars unless and until required.	3	[3, 3, 3, 3, 3]	3.0	train
126	Air in China is not so clean because of cars.	4	[4, 3, 3, 4, 4]	3.6666666666666665	dev
127	When price of gas goes up, the consumer do not want buy gas for fuels.	3	[3, 3, 2, 3, 2]	2.6666666666666665	dev
128	For example, the professor example with rabbits hairs.	2	[3, 3, 4, 3, 3]	3.0	train
129	The professor believes that thic kind of learning will not have the success the books did.	4	[3, 4, 3, 3, 2]	3.1666666666666665	train
130	although , learning more subjects gives us a huge knowledge which is make me sucssesfu in my study.	3	[3, 3, 3, 3, 2]	2.8333333333333335	dev
131	After retirement they may not be having a lot of money to enjoy their life in the way they would like to.	3	[3, 3, 3, 4, 4]	3.3333333333333335	train
132	etc.	0	[]	0.0	none
133	Like how take the airplan, how chage time and time is important to him.	1	[3, 2, 3, 3, 2]	2.3333333333333335	train
134	If every people thinks to learn and understand lots of scientifc subjects, any person will do not do it and as a result of this any science isn't imporeved.	2	[3, 2, 2, 1, 1]	1.8333333333333333	test
135	Do you think drive more?	2	[2, 2, 1, 1, 2]	1.6666666666666667	train
136	When you`re making a tour guide trip, you already have a everything settled from the time you`re departing to the time you arrive.	3	[4, 3, 4, 4, 3]	3.5	dev
137	On the other hand, although in Turkey the public transportation is getting developed especially in the two big cities, that is, Ankara and istanbul, it is still nothing compared to Sweden.	4	[4, 2, 3, 3, 3]	3.1666666666666665	dev
138	This rebuffs the reading passage's claim that there is no improvement.	4	[3, 3, 3, 4, 3]	3.3333333333333335	dev
139	Thus in concordance with the above I agree whole heartedly that in twenty years there will be fewer cars in use than there are today.	4	[3, 3, 3, 4, 3]	3.3333333333333335	test
140	As they are involved with study, they donot get enough time to look after their community.	4	[3, 3, 3, 3, 3]	3.1666666666666665	dev
141	poor sosaites choses to ues puplic tranportion such as buses , tranes , boates , ... , etc .	3	[2, 1, 3, 1, 1]	1.8333333333333333	train
142	Third the butt it in hte front of the door of store to make the poeple see it even if it is not good	2	[1, 2, 1, 2, 1]	1.5	test
143	I don't agree with this statement, and I will develop my point of view in a three-part explanation.	4	[4, 4, 4, 3, 4]	3.8333333333333335	train
144	I prefer going to travel with a group to going alone.	3	[3, 3, 3, 3, 3]	3.0	train
145	Firstly , it can help studengts become more emtionally engaged with the mateial, especilly history and social studies which people insterest in .	3	[3, 3, 3, 3, 3]	3.0	train
146	However, I strongly maintained that traveling by their own gives a lot of advantages.	3	[4, 4, 3, 3, 3]	3.3333333333333335	dev
147	However, are these things all good to people?	4	[4, 3, 4, 4, 3]	3.6666666666666665	test
148	The even ask themself how this kind of things didn't cross their mind.	3	[3, 2, 3, 3, 3]	2.8333333333333335	dev
149	Very soon they will run out at the current rate of utilisation.	4	[3, 3, 3, 3, 4]	3.3333333333333335	test
150	In the lecture, however, professor oppose the reading statement.	3	[4, 3, 3, 3, 3]	3.1666666666666665	test
151	But YOU have to create these opportunities.	4	[3, 3, 3, 4, 4]	3.5	test
152	People tends to choose other medias, and that is why litterature is in danger.	3	[3, 2, 4, 3, 4]	3.1666666666666665	dev
153	I cast doubt that twenty years is too short time to prove the problem.	2	[4, 3, 3, 4, 3]	3.1666666666666665	dev
154	If one just spend most of the time on learning knowledge of many subjects, he or she may not have the time to do related research.	3	[3, 3, 4, 3, 3]	3.1666666666666665	train
155	Throughts our lives needs talk about our familys.	1	[3, 2, 4, 2, 2]	2.3333333333333335	test
156	Also they can be ore effective in recognising cars ID, but the question is will it be suitsble to get red of patrols by using this technology since patrols can work together and also they can enhance their performance of sure .	2	[3, 1, 2, 1, 3]	2.0	train
157	So for these reasons i really believe that it's important to have a broad knowledge on different subjects, instead of being focused on just one, because sometime the answer that we are searching for, we can easily find it in a field that can seems not related to our purpose.	3	[3, 4, 3, 2, 4]	3.1666666666666665	dev
158	I am pleased to know intelligent peple and learn about things which I don't know.	4	[4, 3, 4, 4, 4]	3.8333333333333335	dev
159	Then people have any big trouble can not to break it out , we can use the computer to esay to do it without any difficult.	2	[3, 3, 3, 3, 1]	2.5	train
160	They try new things .	4	[4, 4, 3, 4, 4]	3.8333333333333335	test
161	Therefore, I agree this statement	3	[3, 3, 4, 2, 3]	3.0	train
162	Inorder to do this, they would need to learn additionally skills, either theoretical or practical, that would increase their understanding and future application of their chosen subject.	3	[2, 3, 3, 3, 3]	2.8333333333333335	test
163	if you want a product you give create a beautiful image around it if you want sell it.	2	[3, 3, 1, 3, 4]	2.6666666666666665	test
164	As far as I am concerned, however, I think it is better to travel in a gruop led by a tour guide.	4	[3, 4, 4, 3, 4]	3.6666666666666665	train
165	and in summer they hawve to sold air conditioner.	3	[3, 2, 3, 2, 2]	2.5	train
166	and dont wont stady new sthings .	2	[3, 3, 3, 3, 3]	2.8333333333333335	train
167	It is goo	0	[]	0.0	none
168	Finally, they can travel to other countries through programs in internet.	3	[3, 3, 4, 4, 3]	3.3333333333333335	train
169	just like others you have already bought..	4	[2, 3, 4, 3, 3]	3.1666666666666665	train
170	Secondly the place of the film must must be very clear and chir must be relax etc.	2	[3, 2, 2, 3, 3]	2.5	test
171	even they can't spend enoungh time with their families.	4	[3, 3, 4, 3, 3]	3.3333333333333335	train
172	and will put you maind on a non-stop learning...	3	[3, 2, 3, 3, 3]	2.8333333333333335	test
173	this will the proof of speeding offense so that polices can easily catch them..	2	[2, 3, 3, 3, 4]	2.8333333333333335	test
174	In today's Compuer skill is first important life skill.	2	[3, 2, 2, 3, 2]	2.3333333333333335	test
175	Every patients can not buy that medicine but that cost must be part of finding new drugs.	3	[3, 3, 4, 3, 4]	3.3333333333333335	train
176	To resolve this problem, the governments of the cities are likely to improve the public transportation system by building new subway system and adding more lines for buses.	3	[3, 4, 3, 4, 4]	3.5	dev
177	You can just know all materilas behaviour and some other basic things .	4	[3, 4, 4, 1, 2]	3.0	train
178	we can enjoy the whole life as the happiness is presents inside ourselves and not any other place and this is the secret...	3	[3, 3, 2, 3, 3]	2.8333333333333335	train
179	He last choosed to learn truth.	3	[3, 3, 3, 3, 3]	3.0	test
180	But they are very shy.	4	[4, 3, 4, 4, 4]	3.8333333333333335	train
