Id	Sentence	Expert Judgement	Crowd Flower Judgements	Average	Dataset
2289	In order to maintain old buildings cost a lot of money.	3	[2, 3, 1, 2, 2]	2.1666666666666665	dev
2290	Do we consider her as a smart girl?	3	[4, 3, 4, 4, 3]	3.5	test
2291	For example most people know something about computers.	4	[3, 3, 3, 4, 4]	3.5	train
2292	For example in a chemistry class when you talk about oxygen is needed for a burning process you can give a fact to support your idea which is you can put out a fire with a blanket by cutting the oxygen.	2	[3, 4, 3, 4, 2]	3.0	test
2293	Finally, the author points that the fires led to decreace in the local economy by cutting the tourist season.	3	[3, 3, 3, 3, 4]	3.1666666666666665	train
2294	These factors can only contribute to growth in number of cars.	3	[3, 4, 3, 3, 4]	3.3333333333333335	dev
2295	We do not need to look for parking space.	3	[4, 4, 4, 4, 4]	3.8333333333333335	dev
2296	He did not afraid took the risk.	2	[2, 3, 3, 3, 2]	2.5	train
2297	etc.	0	[]	0.0	none
2298	they bilive in more and more hard work so this ststment is fals.	4	[1, 2, 3, 2, 2]	2.3333333333333335	train
2299	Sometimes, it is very comportable but, it's not important for me.	3	[3, 3, 3, 3, 3]	3.0	dev
2300	I can count a lot of reasons why two subjects should simultaneously develop.	4	[4, 4, 4, 3, 3]	3.6666666666666665	train
2301	Especially in foreign coutries, there may be dangeous places and unknown rules or laws for tourists.	4	[4, 4, 4, 4, 3]	3.8333333333333335	train
2302	So young people also do hardwork but they make some shedule and follow that.	3	[2, 2, 4, 3, 2]	2.6666666666666665	train
2303	Doing some thing and getting appreciated for the same, is an enjoyment in itself.	3	[3, 3, 3, 3, 3]	3.0	train
2304	Internet encyclopedias can contribute a new articles or make an editorial change.	3	[3, 3, 3, 3, 3]	3.0	dev
2305	Pollution everywhere, ozone shield will disappeare, we will live on one-big-speedway.	3	[3, 3, 2, 2, 2]	2.5	train
2306	why do students self-killing?	2	[3, 3, 3, 2, 2]	2.5	train
2307	It so happens very often that many companies are involved in making the same product and this means competition.	4	[4, 4, 3, 4, 3]	3.6666666666666665	dev
2308	Why there isn't one that was left around Tunguska?	3	[4, 3, 1, 3, 3]	2.8333333333333335	dev
2309	i dont like people whome lost them time and they can't use all the time.	2	[2, 2, 2, 3, 3]	2.3333333333333335	train
2310	Have you ever think about this?	3	[3, 4, 3, 3, 3]	3.1666666666666665	dev
2311	Because students are young.	4	[3, 4, 3, 4, 4]	3.6666666666666665	dev
2312	Especially the service is often achieved by helping out in charity events or fundraising for local communities but also for bigger organisations for example UNICEF.	4	[3, 3, 4, 3, 1]	3.0	train
2313	It mist be seem like same and indifferent.	2	[3, 3, 1, 3, 2]	2.3333333333333335	train
2314	When I traveled to Hongkong, I bough a lot of food even though I did not know what they were.	3	[3, 3, 3, 2, 3]	2.8333333333333335	train
2315	That is in part what constituted the appeal of the country to the generations of immigrants that went over there.	4	[4, 3, 3, 4, 4]	3.6666666666666665	train
2316	Third, the erosion was not a sign that the Sphinx and the Old Kingdom are the same degree.	4	[3, 3, 3, 4, 2]	3.1666666666666665	train
2317	However, all around us, one can see young people of all ages, cultures and nationalities doing what they can to help their community.	4	[3, 4, 4, 4, 4]	3.8333333333333335	train
2318	If Young people understand	4	[3, 4, 3, 3, 4]	3.5	train
2319	It's more practical for everybody	4	[3, 3, 3, 3, 4]	3.3333333333333335	train
2320	This is in contrast to the point in the reading that advertising does not produce any effect on American epople because they receive bombardment from different sources.	3	[3, 4, 3, 3, 2]	3.0	dev
2321	In countries where we expect a surge in personal income, as most economists do for the heavily populated nations China and India, we can expect those countries to have much more cars in the next twenty years than they do nowadays.	4	[1, 4, 4, 3, 3]	3.1666666666666665	train
2322	Driving a car requires concentration and that could cause headade whereas travelling in a train or a bus provides people with relaxing time.	3	[3, 3, 3, 3, 3]	3.0	train
2323	First, cleaning up does not necessary	0	[]	0.0	none
2324	Every beginning has its end.	4	[4, 4, 4, 4, 4]	4.0	test
2325	Who we mach them togather.	1	[3, 1, 1, 2, 2]	1.6666666666666667	test
2326	If they teach them , they will never forget it and it is benefitial for our country.	4	[4, 2, 3, 4, 4]	3.5	dev
2327	from now on, people always get more than two jobs in his or her life, becauce of the compator.	2	[1, 2, 2, 3, 3]	2.1666666666666665	train
2328	I can not imagine that during the next 20 years anything could hinder a American to use his car to drive down to the post office which is only 3 blocks away.	4	[3, 4, 3, 3, 4]	3.5	dev
2329	For example, in children.	0	[]	0.0	none
2330	also the external factor that help ij this action ise the mineral magnetite in their beaks that help when they have to sening the direction because it serve bird as an internal compass.	3	[1, 1, 1, 1, 2]	1.5	train
2331	They explain the specific points useing the examples about dinosaurs's behabiar and physical face.	3	[3, 3, 3, 3, 2]	2.8333333333333335	test
2332	For instance, when I was elementary school, I learned mathmatics formura without concept.	3	[3, 3, 3, 3, 4]	3.1666666666666665	dev
2333	When you look at the Honda Civic's advertising, it looks fancy as Mercedes, too.	3	[3, 4, 4, 3, 4]	3.5	dev
2334	knowledge .	0	[]	0.0	none
2335	That's the way it is.	4	[4, 4, 4, 4, 4]	4.0	dev
2336	Those people usually have already gained acknowledgement in the job world and in society .	4	[4, 4, 4, 3, 3]	3.6666666666666665	train
2337	that would be frequently asked qeuestion, so to answer this question we should be aware of the facts.	3	[3, 3, 2, 3, 3]	2.8333333333333335	dev
2338	the lecture mentions about Mongol court recods of the time.	2	[3, 2, 3, 4, 3]	2.8333333333333335	test
2339	It is harmful for many others animals as well as it pollutes the water sources.	3	[4, 3, 3, 4, 3]	3.3333333333333335	test
2340	first, theacher is make a right way give to us, so every teacher is make a confidence to students.	2	[1, 2, 1, 2, 2]	1.6666666666666667	test
2341	According to the researchers, the existing oil tanks may last for another 25-30 years.	4	[3, 3, 3, 4, 4]	3.5	train
2342	Something like Interpols, UNICEF, National Amnesty, Borderless Doctors Consference, UN, APEC, World Trade Organizations, Non Government Organizations, North America Free Trade Associations etc...	0	[]	0.0	none
2343	However far we try to cast a view, gas has become a very expensive item that will even become more expensive.	4	[4, 3, 3, 3, 3]	3.3333333333333335	dev
2344	We don't usually study these subject very deaply .	4	[3, 3, 3, 3, 3]	3.1666666666666665	test
2345	In the listening passage, the lecture, however, thinks differently.	3	[3, 2, 3, 4, 3]	3.0	train
2346	It is considered that the answer is negative.	4	[4, 3, 4, 4, 3]	3.6666666666666665	train
2347	ey are more people in the world today so i strongly b	0	[]	0.0	none
2348	clearly, you must show you skills and by speaking .	2	[2, 3, 3, 2, 3]	2.5	dev
2349	Today, new innovatives ideas of technology are coming.	3	[3, 4, 4, 4, 4]	3.6666666666666665	train
2350	That will make the present day cars obsolete and reduce the number of cars in use.	4	[3, 4, 4, 3, 3]	3.5	train
2351	It is very important for theme to understand ideas and concepts than it is for them to learn facts.	3	[3, 3, 3, 3, 3]	3.0	dev
2352	For example, physics is now separated from astronomy or even mathematics, divided itself in geometry and so forth.	3	[2, 4, 3, 4, 2]	3.0	train
2353	Rather than keep his investment within the confines of the oil bussiness where he is the master he went ahead with his new plan.	3	[4, 3, 3, 4, 4]	3.5	dev
2354	They complete each other.	4	[4, 3, 4, 4, 4]	3.8333333333333335	dev
2355	You often find people investing money in inventions only to sustain their own business.	4	[4, 4, 3, 4, 4]	3.8333333333333335	test
2356	For instance many people use airplane, ship, and train.	3	[3, 4, 3, 4, 4]	3.5	test
2357	As a former Law Teacher at the University of Belgrano, I have experienced the problems students faced when taking their oral law examinations.	4	[3, 4, 4, 3, 4]	3.6666666666666665	test
2358	Even manages who are said to possess knowledge about all pocesses under their charge have an area of specialization when they graduate, are hired and are on the job.	3	[3, 3, 1, 3, 3]	2.6666666666666665	train
2359	Therefore, if someone comes up with that breakthrough or innovative ideas, he will be the first to capitalize it.	3	[3, 4, 4, 3, 4]	3.5	dev
2360	When does it stop nobody really knows.	3	[3, 3, 4, 4, 3]	3.3333333333333335	train
2361	students may doas not anderstand facts very will antell they ander stand the idea and concept that is related to the fact.	2	[1, 1, 2, 1, 2]	1.5	dev
2362	I think raising the gas tax is batter.	3	[3, 3, 3, 3, 3]	3.0	train
2363	First reason, students are very critism and always have many ideas to develop her opinion.	2	[3, 3, 2, 3, 3]	2.6666666666666665	test
2364	They may go to the house whitch the elderly person lives, and help to eat food and walk.	2	[3, 3, 2, 3, 3]	2.6666666666666665	test
2365	And there is no proof to that there is a water on Mars.	3	[2, 4, 4, 3, 3]	3.1666666666666665	train
2366	They wander in the streets wearing all kinds of clothes.	4	[4, 4, 4, 4, 4]	4.0	dev
2367	However, almost all of tour guide would go there with my group members and me.	3	[4, 3, 3, 3, 3]	3.1666666666666665	dev
2368	And then the Internet knows almost all of things politics, culuters, sports, music, celeblirites etc.	3	[2, 3, 2, 3, 2]	2.5	train
2369	if you consider a newly marriaged couple the go on roaming to fulfill their desires and enjoyments .	3	[3, 3, 1, 4, 3]	2.8333333333333335	train
2370	There are a lot of big streets in my town.	4	[3, 3, 4, 4, 4]	3.6666666666666665	test
2371	But this does not happen.	4	[4, 4, 4, 4, 3]	3.8333333333333335	dev
2372	In history, for example, it is helpful to understand what event causes another one, and why; in this way, it is easier to learn that the first one occurs before the second one, and thus it is easier to learn dates.	4	[2, 4, 3, 4, 4]	3.5	dev
2373	The fact is that by making the nails ourselves they would probably cost us more than buying them.	4	[4, 3, 3, 4, 4]	3.6666666666666665	dev
2374	the you ng passes the diseases to a couple of people here the young still enjoying life	2	[3, 1, 1, 3, 2]	2.0	test
2375	There are my children who are not going to school or colleges and coming to movies.	2	[4, 3, 3, 1, 3]	2.6666666666666665	dev
2376	how about when we just enjoying this dreamy place and suddenly the leader of tour just tell us: well, i have to leave early because of the tickets, the company had changed the plan for this tour because something something...	3	[2, 3, 3, 2, 3]	2.6666666666666665	train
2377	It would be a really wasteful idean.	4	[2, 3, 3, 3, 3]	3.0	test
2378	Having a car is seen as convinient and time-saving as you do not have to rely on public trasportation and plan ahead to the same extent than using other transportation, and In my opinion, this will be a higher proior.	3	[3, 2, 3, 3, 4]	3.0	train
2379	i believe every successful person worked hard take risks and try new things in order to achieve there goals.	2	[3, 3, 3, 3, 2]	2.6666666666666665	train
2380	But it is very important to get a reputable one, after all you are paying loads of money for their services.	4	[3, 3, 4, 4, 4]	3.6666666666666665	train
2381	internet and also in small masseges .	0	[]	0.0	none
2382	and may be on the way, is too much the trafic lamp.	2	[3, 3, 3, 3, 2]	2.6666666666666665	train
2383	we enjoyed so much in this class.	4	[4, 3, 3, 3, 3]	3.3333333333333335	train
2384	Young people think about life rather.	3	[2, 3, 3, 3, 3]	2.8333333333333335	train
2385	That implies, of course, risks.	4	[2, 3, 4, 3, 4]	3.3333333333333335	train
2386	But, in the technology and evolution time people's mind had arrived to a solution, they must decrease water carriers or water way ships which travel between North America and The Eastern Europe, or build more canals and ship ports so the load on the ship can be decreased and less zebra mussel is transported.	3	[2, 2, 4, 3, 2]	2.6666666666666665	dev
2387	For example, they can read again if they want, and back to the page that they can not understand or they are impressed.	2	[1, 1, 3, 1, 2]	1.6666666666666667	test
2388	They woulnd not able to get time so often to do so, when they are l young.	3	[2, 3, 3, 2, 1]	2.3333333333333335	train
2389	because in the school they teach the student how to understand and how to read and write but they dond give him examples about the real life about the facts or they dont give him practices that he should do it in the ground to be prapered to the second when he will go to the SOUK to work and to do his own life and if any problem faced him the most emportant think he had !	0	[]	0.0	none
2390	It can be good opportunity to make their own time to do anything.	3	[4, 4, 4, 3, 2]	3.3333333333333335	dev
2391	In that time the people will use the more traffic tools and in nature, the car will disappear.	3	[1, 3, 4, 3, 2]	2.6666666666666665	train
2392	So the taxes won't use for their real purpose.	3	[3, 3, 2, 3, 3]	2.8333333333333335	train
2393	And in tweenty years cars will not only to help people to move.	3	[2, 3, 3, 4, 3]	3.0	train
2394	However, she also said that some kinds of birds are shrink.	3	[3, 3, 3, 3, 3]	3.0	dev
2395	Even if the same score is given to them, they will work hard to competit with other groups.	4	[3, 3, 3, 3, 3]	3.1666666666666665	train
2396	Another reason is the person should have a lot of knowledge in diffrent subjects is to know how to communicate with the other people with diffrent cultural and the people think that a person who dose not have a good experiance in each subjects is stupied because as i said that our life need a strong person with a lot of knowledge.	1	[3, 3, 3, 3, 3]	2.6666666666666665	train
2397	For exemple, the american Adeson who made more the 1900 new stuff in his life, and when he try to bulid the first lamp in the world he failing more than 1000 times.	2	[2, 3, 3, 2, 1]	2.1666666666666665	train
2398	In conclusion, These treasures are not factua	0	[]	0.0	none
2399	Nevertheless, they still do the perfect job, this is because they love their jobs and want to feel the happniess from the job, also, the self-easteem promote them to become more efficiency.	3	[3, 3, 3, 2, 3]	2.8333333333333335	train
2400	The problem with this was painfully put forward when I had to report the province of a part of my own country.	3	[4, 3, 3, 3, 2]	3.0	train
2401	Theproblems in between is much more .	3	[2, 3, 2, 3, 3]	2.6666666666666665	train
2402	Just the brand name differs.	4	[3, 4, 3, 4, 4]	3.6666666666666665	train
2403	Yet I am sure there are a number of exapmles of people who have achieved success that would prove the statement wrong.	4	[3, 3, 3, 3, 3]	3.1666666666666665	dev
2404	Nevertheless, I believe that the reasons I have provided in favor of my viewpoints are stronger.	4	[3, 4, 3, 4, 4]	3.6666666666666665	train
2405	because they will have the tendency of mistrust and expectation of dishonesty to the person.	3	[3, 3, 3, 3, 3]	3.0	train
2406	These explanation and examples are proven through my experiences.	3	[3, 3, 3, 4, 3]	3.1666666666666665	train
2407	Tour guides are generally trained and certified by some supervising entities, therefore they are expected to be ready to provide the best possible guide to their customers.	4	[4, 4, 4, 4, 3]	3.8333333333333335	test
2408	There is also a facility to insured your car to any insurance company.	3	[3, 3, 3, 3, 3]	3.0	train
2409	However I still believe that learnng facts are important for student.	3	[3, 3, 3, 4, 3]	3.1666666666666665	test
2410	This is obvious from the fact that when the mind is not clear and free, man cannot involve himself completely in doing any activity.	3	[3, 4, 4, 4, 3]	3.5	dev
2411	So I think it is better to have a broad knowledge of academic subjects.	4	[4, 4, 3, 3, 4]	3.6666666666666665	train
2412	whlie you will be help each other of work together after gratuation from university.	1	[3, 1, 2, 2, 2]	1.8333333333333333	test
2413	However, I have different way of thinking toward the quote.	3	[3, 3, 3, 3, 4]	3.1666666666666665	dev
2414	The mountain has a bus.	4	[3, 3, 3, 4, 4]	3.5	train
2415	so advertisement is a good way to s	0	[]	0.0	none
2416	Thus, it will be fair to the people.	4	[3, 3, 4, 4, 4]	3.6666666666666665	train
2417	It is the extra money for teachers who have better students.	4	[3, 4, 3, 4, 4]	3.6666666666666665	train
2418	the main idea was to be able to travel long distances more efficiently than using a horse and buggy.	4	[3, 3, 3, 4, 4]	3.5	train
2419	First, young people have a lot of problems.	4	[4, 4, 4, 4, 4]	4.0	dev
2420	he usually bring a book, and ask something to some one, he wants to understand the bood	3	[3, 3, 2, 1, 2]	2.3333333333333335	test
2421	Operation room is not a bookmaker office or lottery house.	3	[4, 3, 3, 1, 3]	2.8333333333333335	test
2422	This is an effective solution to stop an advancing fires.	3	[3, 3, 4, 3, 3]	3.1666666666666665	dev
2423	So people who can not affor a car today they will have one in the future.	3	[3, 3, 3, 3, 3]	3.0	train
2424	This always chalanges the consumers to buy a perticular commodity in order to satisfy their needs and want in the morden days.	3	[3, 3, 4, 2, 3]	3.0	dev
2425	Sometime it is a test for individual to know where you are determining your standard.	3	[2, 2, 3, 4, 3]	2.8333333333333335	train
2426	and they get less score in that academically performances	2	[3, 3, 3, 3, 3]	2.8333333333333335	train
2427	Fro exemple, it will be easier for people to concentrate on a subject such as geology, having a broad knwoledge of many academics, than to try to concentrate on geology after having studied litterature.	3	[3, 1, 3, 3, 3]	2.6666666666666665	dev
2428	The second reason is that to study one specific subject make us be nallow charaacter.	3	[3, 3, 3, 4, 2]	3.0	train
2429	The youth are becoming more and more career oriented than before.	4	[3, 3, 4, 4, 4]	3.6666666666666665	train
2430	Automobiles signified the entry of man into a new era of communication; suddenly the world became a much smaller place.	4	[3, 3, 3, 4, 4]	3.5	train
2431	After a official training course, we helped the patients to bath, talked with the elder people who lived alone, and helped the organization to hold activities during special occasions like the mother's day.	3	[3, 4, 3, 3, 3]	3.1666666666666665	dev
2432	You can buy a vavilla cake in a fine store and another vanilla cake in the regular store.	4	[3, 3, 3, 3, 3]	3.1666666666666665	dev
2433	some guider is not sure about information.	3	[3, 3, 3, 3, 2]	2.8333333333333335	dev
2434	Now there are many kind of materials.	4	[4, 3, 4, 4, 3]	3.6666666666666665	train
2435	And even though older people do surely enjoy life, the young do it considerably more in my opinion.	4	[3, 4, 3, 3, 3]	3.3333333333333335	train
2436	They share their views and ideas within a group.	4	[4, 4, 4, 4, 4]	4.0	dev
2437	Hope is the main key for finding new task.	3	[4, 4, 3, 4, 3]	3.5	dev
2438	This means the more languages you know the better you can come along in other countries.	3	[4, 4, 4, 3, 3]	3.5	test
2439	This is because, the choice can appear to students as a common part .	3	[3, 3, 3, 2, 3]	2.8333333333333335	dev
2440	Thus, the products that advert is very different from real product	2	[3, 3, 3, 3, 3]	2.8333333333333335	train
2441	Recently scientist have been working on new generation lie detector that can perform brain- scanning to find out if person telling the true.	3	[4, 3, 3, 4, 3]	3.3333333333333335	test
2442	Developing communities want to build more modern duildings.	4	[3, 3, 4, 4, 3]	3.5	dev
2443	In this sense, many countries enacted laws to protect consumers against marketing and other kinds of abuses aiming to reach a balance between the the consumer needs and industry of the capitalism.	3	[3, 3, 4, 3, 3]	3.1666666666666665	train
2444	By keeping his focus on one industry and one subject, he ensures that he is up-to-date and fully aware of all the current happenings in the industry or subject.	4	[4, 4, 4, 4, 4]	4.0	test
2445	This is because of the large number of fish in the small pond that develop diseases and other infections.	4	[4, 4, 4, 4, 4]	4.0	train
2446	For me, I can do whatever I want and study major for my interesting.	3	[2, 2, 3, 2, 3]	2.5	train
2447	By being with them a person will be well known about all those things talked therewhich he had missed.	3	[3, 3, 4, 2, 3]	3.0	train
2448	It is a pollutiont in the air so sulfur dioxide can effect to breathing problems and various respiratory illnesses ans heart disease.	2	[2, 2, 3, 2, 3]	2.3333333333333335	train
2449	So she thinks that the reading is wrong, and she said the world today is beautiful and didn't need to change, but if change, must change incal.	2	[1, 3, 3, 3, 3]	2.5	train
2450	In opposite, these numbers will grow even much faster, as a newly formed middle class will be able to afford cars.	3	[3, 3, 3, 4, 3]	3.1666666666666665	train
2451	People die for this.	2	[3, 4, 4, 4, 4]	3.5	train
2452	Do you prefer to go to a specialist or general doctor?	4	[4, 4, 4, 4, 4]	4.0	train
2453	So that this theory, magnetite crystals serve birds as an internal compass.	2	[3, 3, 3, 3, 3]	2.8333333333333335	train
2454	They success and they had the power.	2	[3, 2, 3, 3, 3]	2.6666666666666665	test
2455	It will be always puls things for them.	2	[4, 3, 3, 3, 1]	2.6666666666666665	test
2456	Although some people might argue that there are a lot of pollutions in the world , we have to deal the problem which we can solve first.	3	[3, 3, 3, 2, 3]	2.8333333333333335	train
2457	I strongly believe that in twenty years there will be fewer cars in use than there are today because of the damage decreasment, and technology replacment.	3	[3, 3, 3, 4, 4]	3.3333333333333335	dev
2458	Contrarily, people avoid taking risk, will, in most of the cases, take their way through the hierarchy of their organization.	2	[4, 2, 3, 2, 3]	2.6666666666666665	train
2459	Therefore we can enjoy two times.	2	[3, 3, 3, 3, 4]	3.0	train
2460	person also have some person who always stand for his help.	3	[3, 3, 2, 2, 3]	2.6666666666666665	train
2461	Simply not worth the money for the little time they lasted.	4	[3, 3, 3, 4, 4]	3.5	train
2462	Most important, however, zebra mussels often have no predators in their new habitats, and species without natural predatpres are likely to dominate their habitats.	4	[3, 2, 4, 3, 3]	3.1666666666666665	dev
2463	But it's for sure that it's always a problem for us to identify what is more important for us.	4	[4, 3, 3, 4, 3]	3.5	train
2464	There is going to be a huge market if the product is totally brand new, which is equal to a large chance to make more and lot's of money.	3	[4, 3, 3, 2, 3]	3.0	test
2465	so it will help the student to devlope their on carier by him self and very crafted.	2	[3, 2, 2, 3, 1]	2.1666666666666665	train
2466	However, I think it is not so bad because advertisements has to be better than real products.	3	[3, 3, 3, 3, 3]	3.0	train
2467	Before wasent like that, we was all tha times under the voluntad of the man, and depending economyc from him.	1	[2, 1, 3, 2, 2]	1.8333333333333333	test
2468	when you are a teenager, you start experiencing some sexual changes, which in contrast changes your way of thinking, thinking more about the other gender than thinking about toys, would enjoy going out with some friends, than staying home playing with your toys.	3	[3, 2, 3, 2, 3]	2.6666666666666665	test
2469	However the lecture, the scientiests opposite that asteroid is recovered.	1	[3, 1, 3, 2, 3]	2.1666666666666665	train
2470	It easy to manage such a certen place but it is not easy to manage as mountanin.	3	[2, 3, 3, 3, 2]	2.6666666666666665	train
2471	Than what ever can be we can faind the right plase to go.	3	[3, 3, 1, 3, 2]	2.5	train
2472	Agreed the older models become obselete but that didn't entailed the demise of the automobiles.	3	[3, 3, 2, 3, 4]	3.0	train
2473	If you want to try the new things all the time, it will make other people think that you are not concenr abuot the recent job you have to do right now and you are not a very stable person.	3	[3, 2, 2, 3, 3]	2.6666666666666665	train
2474	But Saturday to Sunday is free because people do not to go school or do not go to work.	4	[3, 4, 3, 3, 4]	3.5	train
2475	For example, people may find nice cafes which are located far from maojr cities.	4	[3, 4, 3, 3, 3]	3.3333333333333335	train
2476	This will help them to get good marks.	4	[4, 3, 4, 3, 4]	3.6666666666666665	test
2477	By avoiding this it will lead to much purer and natural world for our future generations to live in.	3	[3, 3, 4, 4, 4]	3.5	test
2478	In extreme cases, some even gain weight because of this.	4	[3, 3, 4, 4, 3]	3.5	test
2479	Firstly, some immergent events happening in the other countries or areas may happen in the place you live someday in future.	3	[3, 4, 4, 3, 2]	3.1666666666666665	test
2480	I feel that with the environmentally friendly benefits and with the attachment that society already has on cars will make people keep riding cars.	3	[3, 4, 4, 2, 2]	3.0	test
2481	It is possible that as the energy problem, the people's live styal will be changed.	2	[3, 2, 3, 1, 3]	2.3333333333333335	dev
